<!--
   New Perspectives on XML
   Tutorial 4
   Case Problem 4

   South Racing teams list
   Author: Melissa Coates
   Date: July 24, 2024

   Filename:         teamscars.xml
   Supporting Files: teams.css, cars.css, cars.xml, teams.xsd, cars.xsd
-->

<?xml-stylesheet type="text/css" href="teams.css"?>
<?xml-stylesheet type="text/css" href="cars.css"?>

<teams xmlns:xsi="http://www.w3.org/2001/XMLSchema-instance"
       xmlns="http://example.com/teams"
       xsi:schemaLocation="http://example.com/teams teams.xsd">

   <team tid="t205">
      <title>Rodas Motorsports</title>
      <description>#1 Team in racing</description>
      <series>Indy</series>
      <cars>
         <car cid="nes201">
            <title class="car-title">Straight Away</title>
            <model>Nissan</model>
            <driver>indy</driver>
         </car>
         <car cid="gda100-5">
            <title class="car-title">Quick Start</title>
            <model>General Motors</model>
            <driver>indy</driver>
         </car>
         <car cid="gma005-2">
            <title class="car-title">Stop Blocks Laps</title>
            <model>Ford</model>
            <driver>indy</driver>
         </car>
         <car cid="sob-450V4">
            <title class="car-title">Bendwinder</title>
            <model>Ford</model>
            <driver>412</driver>
         </car>
         <car cid="hen01-53">
            <title class="car-title">Turn Twister</title>
            <model>Nissan</model>
            <driver>indy</driver>
         </car>
      </cars>
   </team>

   <team tid="t105">
      <title>SAM Racing</title>
      <description>Top 10 over last 5 years</description>
      <series>Nascar</series>
      <cars>
         <car cid="nes201">
            <title class="car-title">Straight Away</title>
            <model>Nissan</model>
            <driver>indy</driver>
         </car>
         <car cid="gda100-5">
            <title class="car-title">Quick Start</title>
            <model>General Motors</model>
            <driver>indy</driver>
         </car>
         <car cid="gma005-2">
            <title class="car-title">Stop Blocks Laps</title>
            <model>Ford</model>
            <driver>indy</driver>
         </car>
         <car cid="stu-050V4">
            <title class="car-title">Sleeker</title>
            <model>General Motors</model>
            <driver>278</driver>
         </car>
         <car cid="dej01-003">
            <title class="car-title">84 Racer</title>
            <model>General Motors</model>
            <driver>198</driver>
         </car>
      </cars>
   </team>

</teams>
